{
  "version": 1,
  "year": 2025,
  "semester": "S2",
  "enrolments": [
    {
      "student_id": "S0001",
      "unit_code": "FIT1056",
      "year": 2025,
      "semester": "S2",
      "mark": 65,
      "grade": "C",
      "grade_point": 1.65
    },
    {
      "student_id": "S0003",
      "unit_code": "FIT1059",
      "year": 2025,
      "semester": "S2",
      "mark": 63,
      "grade": "C",
      "grade_point": 1.36
    },
    {
      "student_id": "S0007",
      "unit_code": "ATS1008",
      "year": 2025,
      "semester": "S2",
      "mark": 76,
      "grade": "D",
      "grade_point": 2.27
    },
    {
      "student_id": "S0007",
      "unit_code": "ENG1016",
      "year": 2025,
      "semester": "S2",
      "mark": 72,
      "grade": "D",
      "grade_point": 2.12
    },
    {
      "student_id": "S0007",
      "unit_code": "FIT3199",
      "year": 2025,
      "semester": "S2",
      "mark": 68,
      "grade": "C",
      "grade_point": 1.74
    },
    {
      "student_id": "S0009",
      "unit_code": "ENG1017",
      "year": 2025,
      "semester": "S2",
      "mark": 72,
      "grade": "D",
      "grade_point": 1.91
    },
    {
      "student_id": "S0011",
      "unit_code": "BEX1009",
      "year": 2025,
      "semester": "S2",
      "mark": 72,
      "grade": "D",
      "grade_point": 2.32
    },
    {
      "student_id": "S0014",
      "unit_code": "BEX1014",
      "year": 2025,
      "semester": "S2",
      "mark": 67,
      "grade": "C",
      "grade_point": 1.85
    },
    {
      "student_id": "S0015",
      "unit_code": "FIT1056",
      "year": 2025,
      "semester": "S2",
      "mark": 69,
      "grade": "C",
      "grade_point": 2.07
    },
    {
      "student_id": "S0018",
      "unit_code": "ATS1008",
      "year": 2025,
      "semester": "S2",
      "mark": 63,
      "grade": "C",
      "grade_point": 1.48
    },
    {
      "student_id": "S0018",
      "unit_code": "FIT1059",
      "year": 2025,
      "semester": "S2",
      "mark": 67,
      "grade": "C",
      "grade_point": 1.8
    },
    {
      "student_id": "S0019",
      "unit_code": "ENG2015",
      "year": 2025,
      "semester": "S2",
      "mark": 76,
      "grade": "D",
      "grade_point": 2.45
    },
    {
      "student_id": "S0019",
      "unit_code": "FIT1058",
      "year": 2025,
      "semester": "S2",
      "mark": 80,
      "grade": "HD",
      "grade_point": 2.77
    },
    {
      "student_id": "S0019",
      "unit_code": "FIT3097",
      "year": 2025,
      "semester": "S2",
      "mark": 73,
      "grade": "D",
      "grade_point": 2.42
    },
    {
      "student_id": "S0019",
      "unit_code": "FIT3161",
      "year": 2025,
      "semester": "S2",
      "mark": 72,
      "grade": "D",
      "grade_point": 2.22
    },
    {
      "student_id": "S0019",
      "unit_code": "FIT3163",
      "year": 2025,
      "semester": "S2",
      "mark": 73,
      "grade": "D",
      "grade_point": 2.12
    },
    {
      "student_id": "S0020",
      "unit_code": "ATS3008",
      "year": 2025,
      "semester": "S2",
      "mark": 77,
      "grade": "D",
      "grade_point": 2.61
    },
    {
      "student_id": "S0020",
      "unit_code": "ENG1005",
      "year": 2025,
      "semester": "S2",
      "mark": 78,
      "grade": "D",
      "grade_point": 2.48
    },
    {
      "student_id": "S0020",
      "unit_code": "FIT1045",
      "year": 2025,
      "semester": "S2",
      "mark": 73,
      "grade": "D",
      "grade_point": 2.53
    },
    {
      "student_id": "S0020",
      "unit_code": "FIT2101",
      "year": 2025,
      "semester": "S2",
      "mark": 69,
      "grade": "C",
      "grade_point": 2.19
    },
    {
      "student_id": "S0020",
      "unit_code": "FIT3003",
      "year": 2025,
      "semester": "S2",
      "mark": 78,
      "grade": "D",
      "grade_point": 2.73
    },
    {
      "student_id": "S0020",
      "unit_code": "FIT3179",
      "year": 2025,
      "semester": "S2",
      "mark": 76,
      "grade": "D",
      "grade_point": 2.33
    },
    {
      "student_id": "S0020",
      "unit_code": "FIT3186",
      "year": 2025,
      "semester": "S2",
      "mark": 79,
      "grade": "D",
      "grade_point": 2.76
    },
    {
      "student_id": "S0021",
      "unit_code": "ATS1012",
      "year": 2025,
      "semester": "S2",
      "mark": 72,
      "grade": "D",
      "grade_point": 2.16
    },
    {
      "student_id": "S0021",
      "unit_code": "FIT2100",
      "year": 2025,
      "semester": "S2",
      "mark": 68,
      "grade": "C",
      "grade_point": 2.07
    },
    {
      "student_id": "S0021",
      "unit_code": "FIT3154",
      "year": 2025,
      "semester": "S2",
      "mark": 75,
      "grade": "D",
      "grade_point": 2.27
    },
    {
      "student_id": "S0021",
      "unit_code": "FIT3183",
      "year": 2025,
      "semester": "S2",
      "mark": 70,
      "grade": "D",
      "grade_point": 2.2
    },
    {
      "student_id": "S0022",
      "unit_code": "ATS3003",
      "year": 2025,
      "semester": "S2",
      "mark": 79,
      "grade": "D",
      "grade_point": 2.69
    },
    {
      "student_id": "S0022",
      "unit_code": "BEX1010",
      "year": 2025,
      "semester": "S2",
      "mark": 74,
      "grade": "D",
      "grade_point": 2.57
    },
    {
      "student_id": "S0022",
      "unit_code": "FIT2002",
      "year": 2025,
      "semester": "S2",
      "mark": 74,
      "grade": "D",
      "grade_point": 2.35
    },
    {
      "student_id": "S0022",
      "unit_code": "FIT2082",
      "year": 2025,
      "semester": "S2",
      "mark": 73,
      "grade": "D",
      "grade_point": 2.48
    },
    {
      "student_id": "S0022",
      "unit_code": "FIT3181",
      "year": 2025,
      "semester": "S2",
      "mark": 80,
      "grade": "HD",
      "grade_point": 2.73
    },
    {
      "student_id": "S0022",
      "unit_code": "FIT3199",
      "year": 2025,
      "semester": "S2",
      "mark": 74,
      "grade": "D",
      "grade_point": 2.31
    },
    {
      "student_id": "S0023",
      "unit_code": "ATS2018",
      "year": 2025,
      "semester": "S2",
      "mark": 74,
      "grade": "D",
      "grade_point": 2.29
    },
    {
      "student_id": "S0023",
      "unit_code": "FIT1043",
      "year": 2025,
      "semester": "S2",
      "mark": 76,
      "grade": "D",
      "grade_point": 2.63
    },
    {
      "student_id": "S0023",
      "unit_code": "FIT2104",
      "year": 2025,
      "semester": "S2",
      "mark": 72,
      "grade": "D",
      "grade_point": 1.96
    },
    {
      "student_id": "S0023",
      "unit_code": "FIT2109",
      "year": 2025,
      "semester": "S2",
      "mark": 78,
      "grade": "D",
      "grade_point": 2.54
    },
    {
      "student_id": "S0023",
      "unit_code": "FIT3048",
      "year": 2025,
      "semester": "S2",
      "mark": 70,
      "grade": "D",
      "grade_point": 1.96
    },
    {
      "student_id": "S0023",
      "unit_code": "FIT3181",
      "year": 2025,
      "semester": "S2",
      "mark": 67,
      "grade": "C",
      "grade_point": 1.96
    },
    {
      "student_id": "S0024",
      "unit_code": "BEX3010",
      "year": 2025,
      "semester": "S2",
      "mark": 75,
      "grade": "D",
      "grade_point": 2.21
    },
    {
      "student_id": "S0024",
      "unit_code": "FIT2102",
      "year": 2025,
      "semester": "S2",
      "mark": 70,
      "grade": "D",
      "grade_point": 2.17
    },
    {
      "student_id": "S0025",
      "unit_code": "ATS3014",
      "year": 2025,
      "semester": "S2",
      "mark": 66,
      "grade": "C",
      "grade_point": 1.89
    },
    {
      "student_id": "S0026",
      "unit_code": "FIT3195",
      "year": 2025,
      "semester": "S2",
      "mark": 68,
      "grade": "C",
      "grade_point": 2.03
    },
    {
      "student_id": "S0027",
      "unit_code": "FIT2100",
      "year": 2025,
      "semester": "S2",
      "mark": 74,
      "grade": "D",
      "grade_point": 2.3
    },
    {
      "student_id": "S0028",
      "unit_code": "ATS1009",
      "year": 2025,
      "semester": "S2",
      "mark": 72,
      "grade": "D",
      "grade_point": 2.16
    },
    {
      "student_id": "S0028",
      "unit_code": "FIT1045",
      "year": 2025,
      "semester": "S2",
      "mark": 69,
      "grade": "C",
      "grade_point": 2.02
    },
    {
      "student_id": "S0028",
      "unit_code": "FIT3154",
      "year": 2025,
      "semester": "S2",
      "mark": 65,
      "grade": "C",
      "grade_point": 1.75
    },
    {
      "student_id": "S0029",
      "unit_code": "ATS2013",
      "year": 2025,
      "semester": "S2",
      "mark": 80,
      "grade": "HD",
      "grade_point": 2.91
    },
    {
      "student_id": "S0029",
      "unit_code": "BEX1003",
      "year": 2025,
      "semester": "S2",
      "mark": 77,
      "grade": "D",
      "grade_point": 2.67
    },
    {
      "student_id": "S0029",
      "unit_code": "BEX1004",
      "year": 2025,
      "semester": "S2",
      "mark": 78,
      "grade": "D",
      "grade_point": 2.97
    },
    {
      "student_id": "S0029",
      "unit_code": "BEX1012",
      "year": 2025,
      "semester": "S2",
      "mark": 79,
      "grade": "D",
      "grade_point": 3.03
    },
    {
      "student_id": "S0029",
      "unit_code": "FIT1061",
      "year": 2025,
      "semester": "S2",
      "mark": 80,
      "grade": "HD",
      "grade_point": 2.96
    },
    {
      "student_id": "S0029",
      "unit_code": "FIT2145",
      "year": 2025,
      "semester": "S2",
      "mark": 80,
      "grade": "HD",
      "grade_point": 2.62
    },
    {
      "student_id": "S0029",
      "unit_code": "FIT3097",
      "year": 2025,
      "semester": "S2",
      "mark": 77,
      "grade": "D",
      "grade_point": 2.73
    },
    {
      "student_id": "S0029",
      "unit_code": "FIT3199",
      "year": 2025,
      "semester": "S2",
      "mark": 79,
      "grade": "D",
      "grade_point": 2.76
    },
    {